<?xml version="1.0" encoding="UTF-8"?>
<!DOCTYPE animation SYSTEM "animation.dtd">
<animation>
  <background>../galaxie1.jpg</background>

  <objects>
  
    <object_text 	text="i=1;" 
                 	font="Courier,12,bold"
                 	transparency="true"
                 	fgcolor="125,90,250"
                 	bgcolor="250,245,250">Instruction1</object_text>
                 	
    <object_text 	text="i=2;" 
    				font="Courier,14,plain"
    				fgcolor="210,70,89">Instruction2</object_text>
    				
    <object_text 	text="i=3;" 
    				font="Courier,16,plain"
    				fgcolor="70,210,89">Instruction3</object_text>
    		
    <object_image   image="../spaceship.png">Image1</object_image>
    		
    <object_rectangle width="100" 
    				height="50"
    				bgcolor="160,160,180"
    				fgcolor="0,80,0">Box1</object_rectangle>
    				
  </objects>
  
 

  <programs>
    <program assigned_to="Instruction1">
      <visible value="true" />
      <label value="loop1" />
      <setxy x="100" y="100" />
      <moveto x="200" y="100" dx="5" dy="0" delay="1" />
      <moveto x="200" y="200" dx="0" dy="5" delay="1" />
      <wait value="step1" />
      <state value="step0" />
      <moveto x="100" y="200" dx="-10" dy="0" delay="1" />
      <moveto x="100" y="100" dx="0" dy="-10" delay="1" />
      <trigger object="Instruction2" value="step1" />
      <goto value="loop1" />
    </program>

    <program assigned_to="Instruction2">
      <visible value="true" />
      <label value="loop1" />
      <setxy x="10" y="10" />
      <angle degrees="45" />
      <moveto x="400" y="400" dx="5" dy="5" delay="4" />
      <trigger object="Instruction1" value="step1" />
      <angle degrees="90" />
      <moveto x="10" y="10" dx="-10" dy="-10" delay="2" />
      <trigger object="Instruction1" value="step1" />
      <wait value="step1" />
      <state value="step0" />
      <goto value="loop1" />
    </program>

	<program assigned_to="Instruction3">
      <visible value="true" />
      <label value="loop1" />
      <setxy x="100" y="100" />
      <right x="100" dx="5" />
      <down y="100" dy="5" />
      <left x="100" dx="5" />
      <up y="100" dy="5" />
      <goto value="loop1" />
    </program>
    
	<program assigned_to="Image1">
      <visible value="true" />
      <label value="loop1" />
      <setxy x="400" y="200" />
      <right x="100" dx="5" />
      <down y="100" dy="5" />
      <left x="100" dx="5" />
      <up y="100" dy="5" />
      <goto value="loop1" />
      </program>
      
      <program assigned_to="Box1">
      <visible value="true" />
      <label value="loop1" />
      <setxy x="100" y="300" />
      <right x="100" dx="1" />
      <down y="100" dy="1" />
      <left x="100" dx="1" />
      <up y="100" dy="1" />
      <goto value="loop1" />
      </program>
      
  </programs>
</animation>
